{
  "authentication": {"api_key_env": ""},
  "endpoint": "http://127.0.0.1:18590",
  "generation": {
    "keep_alive": "30m",
    "max_input_tokens": 16,
    "max_output_tokens": 1,
    "seed": 42,
    "temperature": 0.0,
    "thinking": false,
    "top_p": 1.0
  },
  "lora_adapter": {"id": 0, "scale": 1.0},
  "model": "qwen35-0.8b-q8-plus-traffic-lora",
  "provider": "llama_cpp",
  "schema_version": "edge-llm-runtime/v1",
  "timeout_seconds": 5.0
}
